{
  "$schema": "https://json-schema.org/draft/2020-12/schema",
  "$id": "https://reviewgraphen.dev/schemas/reviewgraphen.generic_review_human_report.v2.schema.json",
  "title": "ReviewGraphen generic non-authority human report v2",
  "type": "object",
  "additionalProperties": false,
  "required": ["schema", "audit", "authority", "coverage", "contexts", "proposed_claims", "abstentions", "malformed_outputs", "provider_failures", "provider_free_packet_bindings", "verifier", "exclusions", "deferrals", "source_window_trace", "information_loss", "rendered_markdown_sha256"],
  "properties": {
    "schema": {"const": "reviewgraphen.generic_review_human_report.v2"},
    "audit": {"$ref": "#/$defs/audit"}, "authority": {"$ref": "#/$defs/authority"}, "coverage": {"$ref": "#/$defs/coverage"},
    "contexts": {"type": "array", "maxItems": 2048, "items": {"$ref": "#/$defs/context"}},
    "proposed_claims": {"type": "array", "maxItems": 32768, "items": {"$ref": "#/$defs/proposal"}},
    "abstentions": {"type": "array", "maxItems": 2048, "items": {"$ref": "#/$defs/abstention"}},
    "malformed_outputs": {"type": "array", "maxItems": 2048, "items": {"$ref": "#/$defs/malformed"}},
    "provider_failures": {"type": "array", "maxItems": 2048, "items": {"$ref": "#/$defs/provider_failure"}},
    "provider_free_packet_bindings": {"type": "array", "maxItems": 2048, "items": {"$ref": "#/$defs/provider_free_binding"}},
    "verifier": {"$ref": "#/$defs/verifier"}, "exclusions": {"$ref": "#/$defs/id_set"}, "deferrals": {"$ref": "#/$defs/id_set"},
    "source_window_trace": {"$ref": "#/$defs/source_window_trace"}, "information_loss": {"type": "array", "minItems": 1, "maxItems": 64, "items": {"$ref": "#/$defs/loss"}}, "rendered_markdown_sha256": {"$ref": "#/$defs/hash"}
  },
  "$defs": {
    "hash": {"type": "string", "pattern": "^sha256:[0-9a-f]{64}$"}, "id": {"type": "string", "pattern": "^[a-z][a-z0-9-]*:(?:sha256:[0-9a-f]{64}|[A-Za-z0-9._@:-]+)$"}, "id_set": {"type": "array", "uniqueItems": true, "maxItems": 32768, "items": {"$ref": "#/$defs/id"}},
    "audit": {"type": "object", "additionalProperties": false, "required": ["schema", "run_id", "snapshot_id", "universe_id", "canonical_sha256"], "properties": {"schema": {"const": "reviewgraphen.generic_review_run.v3"}, "run_id": {"$ref": "#/$defs/id"}, "snapshot_id": {"$ref": "#/$defs/id"}, "universe_id": {"$ref": "#/$defs/id"}, "canonical_sha256": {"$ref": "#/$defs/hash"}}},
    "authority": {"type": "object", "additionalProperties": false, "required": ["classification", "trusted_pass", "result_status", "incomplete_reasons"], "properties": {"classification": {"const": "non_authority"}, "trusted_pass": {"const": false}, "result_status": {"const": "incomplete"}, "incomplete_reasons": {"type": "array", "minItems": 3, "uniqueItems": true, "items": {"type": "string", "minLength": 1}}}},
    "coverage": {"type": "object", "additionalProperties": false, "required": ["resolved_target_obligation_ids", "stage_ids", "candidate_space"], "properties": {"resolved_target_obligation_ids": {"$ref": "#/$defs/id_set"}, "stage_ids": {"$ref": "#/$defs/id_set"}, "candidate_space": {"$ref": "#/$defs/candidate_space"}}},
    "candidate_space": {"type": "object", "additionalProperties": false, "required": ["capabilities", "limitation_ids", "gap_obligation_ids", "obstruction_summary_ids", "obstruction_ids", "observed_unresolved_call_occurrence_count", "occurrence_id_set_sha256", "source_occurrence_summaries", "global_direct_calls_limitation", "call_graph_complete", "global_call_coverage_claim"], "properties": {"capabilities": {"type": "object", "additionalProperties": false, "required": ["direct_calls"], "properties": {"direct_calls": {"const": "partial"}}}, "limitation_ids": {"$ref": "#/$defs/id_set"}, "gap_obligation_ids": {"$ref": "#/$defs/id_set"}, "obstruction_summary_ids": {"$ref": "#/$defs/id_set"}, "obstruction_ids": {"$ref": "#/$defs/id_set"}, "observed_unresolved_call_occurrence_count": {"type": "integer", "minimum": 0}, "occurrence_id_set_sha256": {"$ref": "#/$defs/hash"}, "source_occurrence_summaries": {"type": "array", "maxItems": 20000, "items": {"$ref": "#/$defs/occurrence_summary"}}, "global_direct_calls_limitation": {"$ref": "#/$defs/global_limitation"}, "call_graph_complete": {"const": false}, "global_call_coverage_claim": {"const": "prohibited"}}},
    "summary_bucket": {"type": "object", "additionalProperties": false, "required": ["call_kind", "reason", "observed_occurrence_count", "occurrence_id_set_sha256"], "properties": {"call_kind": {"enum": ["direct", "method", "macro_invocation"]}, "reason": {"enum": ["direct_non_path", "direct_empty_path", "direct_shadowed_binding", "direct_unresolved_scope", "direct_target_count_zero", "direct_target_count_multiple", "method_dispatch_unresolved", "macro_expansion_unresolved"]}, "observed_occurrence_count": {"type": "integer", "minimum": 1}, "occurrence_id_set_sha256": {"$ref": "#/$defs/hash"}}},
    "occurrence_summary": {"type": "object", "additionalProperties": false, "required": ["schema", "id", "kind", "severity", "snapshot_id", "projection_extractor_id", "file_source_id", "path", "related_capabilities", "observed_occurrence_count", "occurrence_id_set_sha256", "buckets", "detail_retention"], "properties": {"schema": {"const": "reviewgraphen.ingestion_obstruction_summary.v1"}, "id": {"$ref": "#/$defs/id"}, "kind": {"const": "call_enumeration_summary"}, "severity": {"const": "medium"}, "snapshot_id": {"$ref": "#/$defs/id"}, "projection_extractor_id": {"const": "reviewgraphen.ingest.rust-call-enumeration@2"}, "file_source_id": {"$ref": "#/$defs/id"}, "path": {"type": "string", "minLength": 1}, "related_capabilities": {"const": ["direct_calls"]}, "observed_occurrence_count": {"type": "integer", "minimum": 1}, "occurrence_id_set_sha256": {"$ref": "#/$defs/hash"}, "buckets": {"type": "array", "minItems": 1, "maxItems": 8, "items": {"$ref": "#/$defs/summary_bucket"}}, "detail_retention": {"const": "spans_and_owner_sources_omitted_rebuildable"}}},
    "global_limitation": {"type": "object", "additionalProperties": false, "required": ["schema", "id", "snapshot_id", "projection_extractor_id", "kind", "severity", "description", "source_ids", "related_capabilities", "latent_occurrence_count"], "properties": {"schema": {"const": "reviewgraphen.ingestion_global_limitation.v2"}, "id": {"$ref": "#/$defs/id"}, "snapshot_id": {"$ref": "#/$defs/id"}, "projection_extractor_id": {"const": "reviewgraphen.ingest.rust-call-enumeration@2"}, "kind": {"const": "global_direct_calls_limitation"}, "severity": {"const": "info"}, "description": {"const": "direct_calls enumeration is incomplete; macro latent occurrence count is unknown"}, "source_ids": {"$ref": "#/$defs/id_set"}, "related_capabilities": {"const": ["direct_calls"]}, "latent_occurrence_count": {"const": "unknown"}}},
    "denominator": {"type": "object", "additionalProperties": false, "required": ["cardinality", "observed_count", "sorted_id_set_sha256"], "properties": {"cardinality": {"const": "known"}, "observed_count": {"type": "integer", "minimum": 0}, "sorted_id_set_sha256": {"$ref": "#/$defs/hash"}}},
    "latent_cardinality": {"oneOf": [{"type": "object", "additionalProperties": false, "required": ["state"], "properties": {"state": {"const": "known_zero"}}}, {"type": "object", "additionalProperties": false, "required": ["state", "capability_states", "qualification_ids"], "properties": {"state": {"const": "unknown"}, "capability_states": {"type": "object", "additionalProperties": false, "minProperties": 1, "properties": {"ast": {"enum": ["complete", "partial", "unavailable"]}, "containment": {"enum": ["complete", "partial", "unavailable"]}, "direct_calls": {"enum": ["complete", "partial", "unavailable"]}, "test_mapping": {"enum": ["complete", "partial", "unavailable"]}}}, "qualification_ids": {"type": "array", "uniqueItems": true, "minItems": 1, "maxItems": 64, "items": {"$ref": "#/$defs/id"}}}}]},
    "range": {"type": "object", "additionalProperties": false, "required": ["start_line", "end_line"], "properties": {"start_line": {"type": "integer", "minimum": 1}, "end_line": {"type": "integer", "minimum": 1}}},
    "subject_loss": {"type": "object", "additionalProperties": false, "required": ["id", "endpoint_id", "role", "reason", "source_artifact_id", "requested_range", "property_id", "severity"], "properties": {"id": {"$ref": "#/$defs/id"}, "endpoint_id": {"$ref": "#/$defs/id"}, "role": {"enum": ["callee", "caller"]}, "reason": {"type": "string", "minLength": 1}, "source_artifact_id": {"oneOf": [{"type": "null"}, {"$ref": "#/$defs/id"}]}, "requested_range": {"oneOf": [{"type": "null"}, {"$ref": "#/$defs/range"}]}, "property_id": {"const": "rust.callee_contract_review@1"}, "severity": {"const": "high"}}},
    "subject_outcome": {"oneOf": [{"type": "object", "additionalProperties": false, "required": ["state", "endpoint_id", "role", "source_artifact_id", "requested_range", "window_id"], "properties": {"state": {"const": "admitted"}, "endpoint_id": {"$ref": "#/$defs/id"}, "role": {"enum": ["callee", "caller"]}, "source_artifact_id": {"$ref": "#/$defs/id"}, "requested_range": {"$ref": "#/$defs/range"}, "window_id": {"$ref": "#/$defs/id"}}}, {"type": "object", "additionalProperties": false, "required": ["state", "loss"], "properties": {"state": {"const": "lost"}, "loss": {"$ref": "#/$defs/subject_loss"}}}]},
    "window": {"type": "object", "additionalProperties": false, "required": ["id", "source_artifact_id", "registration_id", "content_hash", "cas_hash", "range", "owner_ids", "roles", "support_anchor_ids", "excerpt_byte_length", "excerpt_hash"], "properties": {"id": {"$ref": "#/$defs/id"}, "source_artifact_id": {"$ref": "#/$defs/id"}, "registration_id": {"$ref": "#/$defs/id"}, "content_hash": {"$ref": "#/$defs/hash"}, "cas_hash": {"$ref": "#/$defs/hash"}, "range": {"$ref": "#/$defs/range"}, "owner_ids": {"$ref": "#/$defs/id_set"}, "roles": {"type": "array", "uniqueItems": true, "minItems": 1, "items": {"enum": ["callee", "caller", "support"]}}, "support_anchor_ids": {"$ref": "#/$defs/id_set"}, "excerpt_byte_length": {"type": "integer", "minimum": 0}, "excerpt_hash": {"$ref": "#/$defs/hash"}}},
    "support_loss_summary": {"type": "object", "additionalProperties": false, "required": ["reason", "cardinality", "observed_count", "sorted_anchor_id_set_sha256"], "properties": {"reason": {"type": "string", "minLength": 1}, "cardinality": {"const": "known"}, "observed_count": {"type": "integer", "minimum": 1}, "sorted_anchor_id_set_sha256": {"$ref": "#/$defs/hash"}}},
    "unknown": {"type": "object", "additionalProperties": false, "required": ["description", "source_ids"], "properties": {"description": {"type": "string", "minLength": 1}, "source_ids": {"type": "array", "uniqueItems": true, "minItems": 1, "items": {"$ref": "#/$defs/id"}}}},
    "context": {"type": "object", "additionalProperties": false, "required": ["wave_id", "context_id", "context_policy_id", "context_policy_hash", "denominator_commitments", "latent_cardinality", "subject_outcomes", "admitted_windows", "support_loss_summaries", "unknowns"], "properties": {"wave_id": {"$ref": "#/$defs/id"}, "context_id": {"$ref": "#/$defs/id"}, "context_policy_id": {"const": "context.subject_windows@3"}, "context_policy_hash": {"const": "sha256:932bfa18c5d286c63196366d6d2dc1aaf402f50baa1f1ab5f075b1007be55dd8"}, "denominator_commitments": {"type": "object", "additionalProperties": false, "required": ["accepted_file", "reached_file", "materialized_source", "support_anchor"], "properties": {"accepted_file": {"$ref": "#/$defs/denominator"}, "reached_file": {"$ref": "#/$defs/denominator"}, "materialized_source": {"$ref": "#/$defs/denominator"}, "support_anchor": {"$ref": "#/$defs/denominator"}}}, "latent_cardinality": {"$ref": "#/$defs/latent_cardinality"}, "subject_outcomes": {"type": "array", "minItems": 2, "maxItems": 2, "items": {"$ref": "#/$defs/subject_outcome"}}, "admitted_windows": {"type": "array", "maxItems": 8, "items": {"$ref": "#/$defs/window"}}, "support_loss_summaries": {"type": "array", "maxItems": 15, "items": {"$ref": "#/$defs/support_loss_summary"}}, "unknowns": {"type": "array", "maxItems": 64, "items": {"$ref": "#/$defs/unknown"}}}},
    "proposal": {"type": "object", "additionalProperties": false, "required": ["obligation_id", "execution_id", "property_id", "target_refs", "polarity", "summary", "source_ids", "status"], "properties": {"obligation_id": {"$ref": "#/$defs/id"}, "execution_id": {"$ref": "#/$defs/id"}, "property_id": {"type": "string", "minLength": 1}, "target_refs": {"$ref": "#/$defs/id_set"}, "polarity": {"enum": ["issue_present", "issue_absent", "inconclusive", "not_applicable", "conflict"]}, "summary": {"type": "string", "minLength": 1}, "source_ids": {"$ref": "#/$defs/id_set"}, "status": {"const": "proposed"}}},
    "abstention": {"type": "object", "additionalProperties": false, "required": ["obligation_id", "execution_id", "reason", "detail"], "properties": {"obligation_id": {"$ref": "#/$defs/id"}, "execution_id": {"$ref": "#/$defs/id"}, "reason": {"type": "string", "minLength": 1}, "detail": {"type": "string", "minLength": 1}}},
    "malformed": {"type": "object", "additionalProperties": false, "required": ["obligation_id", "execution_id", "reason", "diagnostic"], "properties": {"obligation_id": {"$ref": "#/$defs/id"}, "execution_id": {"$ref": "#/$defs/id"}, "reason": {"type": "string", "minLength": 1}, "diagnostic": {"type": "string", "minLength": 1}}},
    "provider_failure": {"type": "object", "additionalProperties": false, "required": ["obligation_id", "execution_id", "retryable", "diagnostic"], "properties": {"obligation_id": {"$ref": "#/$defs/id"}, "execution_id": {"$ref": "#/$defs/id"}, "retryable": {"type": "boolean"}, "diagnostic": {"type": "string", "minLength": 1}}},
    "provider_free_binding": {"type": "object", "additionalProperties": false, "required": ["schema", "id", "task_id", "execution_id", "reviewer_packet_sha256", "source_inventory_id", "source_inventory_sha256", "input_manifest_hash", "observer_id", "observation_record_id"], "properties": {"schema": {"const": "reviewgraphen.provider_free_packet_binding.v1"}, "id": {"$ref": "#/$defs/id"}, "task_id": {"type": "string", "pattern": "^provider-free-review-task:sha256:[0-9a-f]{64}$"}, "execution_id": {"$ref": "#/$defs/id"}, "reviewer_packet_sha256": {"$ref": "#/$defs/hash"}, "source_inventory_id": {"$ref": "#/$defs/id"}, "source_inventory_sha256": {"$ref": "#/$defs/hash"}, "input_manifest_hash": {"$ref": "#/$defs/hash"}, "observer_id": {"const": "deterministic.abstain@1"}, "observation_record_id": {"$ref": "#/$defs/id"}}},
    "verifier": {"oneOf": [{"type": "object", "additionalProperties": false, "required": ["status"], "properties": {"status": {"const": "not_selected"}}}, {"type": "object", "additionalProperties": false, "required": ["status", "id", "descriptor_id", "reason", "process_started", "executable_resolved"], "properties": {"status": {"const": "unsupported"}, "id": {"$ref": "#/$defs/id"}, "descriptor_id": {"const": "workspace.cargo_test@1"}, "reason": {"const": "workspace_cargo_test_deferred"}, "process_started": {"const": false}, "executable_resolved": {"const": false}}}]},
    "source_window_trace": {"type": "object", "additionalProperties": false, "required": ["source_ids", "window_ids", "context_ids"], "properties": {"source_ids": {"type": "array", "minItems": 1, "uniqueItems": true, "maxItems": 32768, "items": {"$ref": "#/$defs/id"}}, "window_ids": {"$ref": "#/$defs/id_set"}, "context_ids": {"$ref": "#/$defs/id_set"}}},
    "loss": {"type": "object", "additionalProperties": false, "required": ["kind", "meaningful", "reason", "recovery_ref", "source_ids"], "properties": {"kind": {"const": "bounded_audit_reduction"}, "meaningful": {"const": true}, "reason": {"type": "string", "minLength": 1}, "recovery_ref": {"$ref": "#/$defs/hash"}, "source_ids": {"type": "array", "minItems": 1, "uniqueItems": true, "items": {"$ref": "#/$defs/id"}}}}
  }
}
