{"abstentions":[],"audit":{"canonical_sha256":"sha256:eca4b3b345db677c2b3a122c0df00e76a2c36e7f5a9a89dc0ced31086845fdbe","run_id":"run:sha256:182759ab4feabb946b825a155ebaf64e4080dc9213fb734982870d9cdd6c4fc8","schema":"reviewgraphen.generic_review_run.v3","snapshot_id":"snapshot:sha256:a02c045d335f2d508261a101edfdb2e158eeacee040a624ce318432875875b2a","universe_id":"universe:sha256:b64ed049eeb043770c1e5eb17a5d0a8d0a0fc0a850a982d0028412d3c1eaa0cf"},"authority":{"classification":"non_authority","incomplete_reasons":["candidate_space_enumeration_incomplete","human_decision_not_recorded","model_observer_non_authority","verifier_unsupported"],"result_status":"incomplete","trusted_pass":false},"contexts":[],"coverage":{"candidate_space":{"call_graph_complete":false,"capabilities":{"direct_calls":"partial"},"gap_obligation_ids":["obligation:sha256:8619c5c8f60b92735be0792bb59c559ed48f77d48bbe39e909985b0e7a3d8cd9"],"global_call_coverage_claim":"prohibited","global_direct_calls_limitation":{"description":"direct_calls enumeration is incomplete; macro latent occurrence count is unknown","id":"ingestion-limitation:sha256:4842f2e3522262e18c05ef06568a0b3b952e4bb28a4cab39edcd42cb7fd2e0f2","kind":"global_direct_calls_limitation","latent_occurrence_count":"unknown","projection_extractor_id":"reviewgraphen.ingest.rust-call-enumeration@2","related_capabilities":["direct_calls"],"schema":"reviewgraphen.ingestion_global_limitation.v2","severity":"info","snapshot_id":"snapshot:sha256:a02c045d335f2d508261a101edfdb2e158eeacee040a624ce318432875875b2a","source_ids":["file:sha256:06212d55b9b8fcede23e542a190d28cf841ae98cf3bdef5d933934a961e250e4","file:sha256:1137d959438b663df7e12d9075e1160d86a9ac24f462392855039f4f82012c09","file:sha256:12cd804f3db2c6abc5cfc5b05531c3d9cfb0804b9deacdd86b1f6776036f8a95","file:sha256:1902616b2e099aed9826db61b4c3db705658b42558b90e2ef4d4a33a498340f5","file:sha256:1aeacecaa284dd174f389e567da5e84bb6c58f53f6b1d9780e343b47ee626452","file:sha256:1bb750b8e93d5a35e7ae4a3f8a70b4bd4de76a6fc346a4c822d5ac6bfcf8a104","file:sha256:25bb690b5b296d973e1136a3ba6ca053a4629eb00bd62afa208614f689fd221b","file:sha256:26ea2ecc9b8df5def22032c481c182f1151b109c1a76aaf67d2798d3f0e952ed","file:sha256:2759e70fc1eab6b95da8c1d6b6860c8ade365b41787bbc40a2e9637f9d6fc94b","file:sha256:2e5f0eab26c227b74805c3de06bfc547f2731d02c88d7f9c781db3f7ca4cff3a","file:sha256:33370d6b0be475429434dee65ee23ac1521b8d8c0e4f702c9eabbe1de9b188df","file:sha256:38ebcd9ac63660f03e96443d99fe92a40481b16fb54fddadc62400a49276e1e0","file:sha256:3cec2a36d19c97f2b7793f5ac9fb21299f02b32736e35e18f4cd21b1811e974b","file:sha256:420f07dc5f398851fea4ac01dceaa3c52c0d1672fb548ab8c57c21e9ac9d56d9","file:sha256:437286fe08643df31ec83dc99f3e558641c05e57716433a3cab975fe4eda7cc2","file:sha256:464cd08064cd1bcd08a7e25bfe93b98f7a06daaf0619b77bcf5b0a04d6be2a8d","file:sha256:472dc3daefe81b37ce86743bd7b91a80b201363cd3d617841e14ffae5fdd7194","file:sha256:4cdef949b7c3e3d7e6ed74f22c15402b8dbe343ffa24c13403eef373f1713223","file:sha256:4dc4674988f77575acf7807984faa0f831772aa6b870b5c52c462a8bdb79a2db","file:sha256:557dde2d73a74f6577d521d274956c20e844a02825ab18f96a736fec947cf776","file:sha256:5ae3be32cba63dc6f9fa6f4a2f59e263cdb3ff512f81d73a35485cd9b8510fe0","file:sha256:5b1cc5252098ac84a8323c7796a73d9cc98f27cf4f8b2562e560a66068941d4d","file:sha256:5bdf30134d55561dd2c15d72ab7dde44db94e6d3abb3ccb2c6b43eb2d0fa2c36","file:sha256:5c34220ae0e9f383a044b6d64e9b12e8904dcd5601f2aa30a0925b3f999717e8","file:sha256:5e2f10cbee124767a28cde60c1d8056a4471e7af38dc52201fc83adff8af2869","file:sha256:61a09274b3fe6049f6000f0b5d32703bea6f6a1b95a256a20d7008abfe7581cc","file:sha256:69c731a1489f4122765e95294589644f306fe397f1f1ce351c15036e50137cf0","file:sha256:6e0f1ddacfbe01f98e2a2dfbe8faa4b3705e0a65f30e5eb68ee1edf211e18fbc","file:sha256:6e37c42dd1632adada7a1ffa9694f03e7d90a93cd0728353bb84518f6302a559","file:sha256:7073a33fcb5ecc7b205ed30242679cfb4db40487dcaec6b506604d38a4c4b2eb","file:sha256:7a5ea4c6c2f5d350ab3cad77061e11ee87928758029f983dfcc087e157cc34ad","file:sha256:7df35eddc919d835ec984ab5c2335c73f80e62b8a797677648a14be57e1e0c6f","file:sha256:846baf72eae50a598b2a7c0121862d884b15fa614becdfebb76343e73354fd71","file:sha256:8a195e5149f394351fa4234198d9f7efdf2a042cbd10bf4e8bcabe26e67258a2","file:sha256:8b821925acb399490fe5be5b9010a87e32a9677f176f92df6ca7d8b9aadc1fb0","file:sha256:94eeeadf17c84dcdf7e8f95c73f1f59cd50a96872250573ed753d6a00b6111dc","file:sha256:95fe50beb74e090c132f7fe949f441c9737216c5dd891fe927ac9157c42321a9","file:sha256:989f8fc99e68dc3f28afe53ca85f2f33657b3061437f4fd5a58aeec7b0926eec","file:sha256:9b69ec48c3c74125a10fadfefd8d80df5e9da0ab3fc70b832f584321c7d082b1","file:sha256:9b7368f1a91052cce970e8a130bf1502070cf1029c3bfcf79ff44e934c6e0466","file:sha256:9cf84cb84608881bffd2deee840cfe674ed9b99b5eee8c9b2e81c1726087e6cf","file:sha256:9f51d7df93925b5521901f755e03a1db8bee5caf6904b2dbe586c3f3e9a3c986","file:sha256:a8e82a55d42b3caf8cdcf4256c872f5dca468fb221847d619948233b51d4e695","file:sha256:ad06a251e7e7d2755cedc9ba0828d1f433717017e1dc21911b99282da3e28216","file:sha256:ae7e920fdf36e0b4935fa19ddc883b0f85ac783bb3989ea8446d6691952372ee","file:sha256:b54012835bc75146b52e2266d61a2538c481fc9d810c0aa7ec045c0793b5d088","file:sha256:b8cf6b5d61767ea0bec29f491d2a1c78941dc77663553dedd646c3c331895158","file:sha256:bacc902c386f60eb41202171df883e08acdcf8670d3c53046c44811908458b05","file:sha256:ca86413339346e5c03aac64fc1445145be59fd5c719a81d65489e51bf35cbfed","file:sha256:cac01f5464ef432f2689543cbcdb483ef3ae44f361aaaac5b4442607d4c024fc","file:sha256:d27ac1bc0fc62aeacdbb5f8495f09edc58e9287b2c8094910658395cb02485a2","file:sha256:d419d4469dd4d031f9561c908bb49838f8553a0c504fec997d443867b0f64879","file:sha256:dda46adbb2fd5a2ccff7b7c1387995a8c5555f5d39416dc0f06b16d29d2aaf73","file:sha256:de105de65fd6a63cc52d50de2af6fa9f11addca1a2d279af1092f1c0edac1a08","file:sha256:df3bf4ee84e4626b4e230607f9f2af8337e6971d5eca582fb5ea872d46cfbd98","file:sha256:eb85c48960facc5c85e40a9ea878dba335f35a815cbdd3f8d33769d769a04eef","file:sha256:f5e627475878e9d43022926109a369d6a297cb4aac5dec2d0139f9ef627487b9","file:sha256:fa30375fa31d3425d627e1b02d2c2cc5bca93641648009a71751c1948de22b0c","file:sha256:fb0a5bf6e42304d69ce8b9fb54c6a85e54b6c955fc241351d80e9d725b0bad26","file:sha256:fb26c76bf7f22307021b5f2beaf62d1e66b265b8f52ec4519a188facff3f3a8b","file:sha256:fcbec1a6e64c803652f41ea733935f1ee05d9acaf8067a20c46c7f328d191cd3"]},"limitation_ids":["ingestion-limitation:sha256:4842f2e3522262e18c05ef06568a0b3b952e4bb28a4cab39edcd42cb7fd2e0f2"],"observed_unresolved_call_occurrence_count":14173,"obstruction_ids":["ingestion-limitation:sha256:4842f2e3522262e18c05ef06568a0b3b952e4bb28a4cab39edcd42cb7fd2e0f2","ingestion-obstruction-summary:sha256:0cf14046c7969a6cb04657bb8f980f6f881d655ec4837eef0c2bdd29a01bf821","ingestion-obstruction-summary:sha256:19b986e90541fda4e49ae46fd1b7c6079ca6cfb6ae6abdaac29ccf9088c0c5f3","ingestion-obstruction-summary:sha256:1ba329b8f8f22229681afd8f87298b2767800172e39e7e6d789748f30e659b5f","ingestion-obstruction-summary:sha256:1f2cf84644589e5ea7950814b329402c2bffb4d129b168a7f0d9685c9f29526c","ingestion-obstruction-summary:sha256:1f8497b884cddc977a8f3c36e6db8f2b9125dc4c31e3db89dc5079515c1c58eb","ingestion-obstruction-summary:sha256:217807c4be73207577b7a6d85c913d00d2639d3d929a4e40d457ad342a7487af","ingestion-obstruction-summary:sha256:251756f9e46ce2c843e62b59e08fe6285f7f9adec8b81054360f50681f982a9c","ingestion-obstruction-summary:sha256:267410fabc3c694942ab368be3e1b3f1dec7b251674e95ce6fb62df79855585b","ingestion-obstruction-summary:sha256:3e010ad51d675b05e10ece8362f714e745d0b42e00e3f5a03344a85fb47d974b","ingestion-obstruction-summary:sha256:401200b1307b5a6a63043732ef16f47dfa66544a363ca01d94f4cbc0ca41030c","ingestion-obstruction-summary:sha256:49f39306920161bb2938333e114338ba9b821034895021c4ad6ab6949471f464","ingestion-obstruction-summary:sha256:4ba6932cba509d19e14b66321134e46374f09e3073edc93323238534434fedac","ingestion-obstruction-summary:sha256:4bfab2b9a7d656e94c918e7c66e8ac40956343045017e790c2546e2ddaf2e34b","ingestion-obstruction-summary:sha256:4df76b268b160b4dd07dadc4a93cdeaf82178055a0965be07076a1426922be93","ingestion-obstruction-summary:sha256:5540078aedcb42fdd4ec5183ec2f9066fa86aba96424a00f1fc97ab46bd70831","ingestion-obstruction-summary:sha256:554c5534547c0643d1c7239d592a23d588581d9d3bb133005bd0b3b97ea059ea","ingestion-obstruction-summary:sha256:5771bbbac6874635fafc9cefdd6e5bd05800ab2c7cc294822ddbca8b50a59cfe","ingestion-obstruction-summary:sha256:58264f72e54eeb89ae2a75150fa51a27ef7a758a9c845b32105b4ec7ab6a71d1","ingestion-obstruction-summary:sha256:661d67673cddd5ad2d29e905fea22105e3a4a1883e76a1e382303d7e8644a85f","ingestion-obstruction-summary:sha256:69ee72005fdf1517f2465a152cd12fdf9bf928885cf8483edbab401d60085c42","ingestion-obstruction-summary:sha256:6c9cf22cfe03dafd7e4ac9f7a24ef3f8f37ed8a68406e6f8e45cec7f1488a4ff","ingestion-obstruction-summary:sha256:738a853619817fb16757e606b44f070cf74398f0b0bf46c5365b2be9e15eae95","ingestion-obstruction-summary:sha256:79dfb7e19c1aea41ee28f05e778300b4ba0fe3bfe84941219157d670d8a24351","ingestion-obstruction-summary:sha256:7a1d3076d433b9b6d4c8a63689913bc774f3c2875358736ea54c5979a720e457","ingestion-obstruction-summary:sha256:7fefb76e5978cd321fb36e8e2dd78a3dca384c61d6b1510a07e167fe2d14e08a","ingestion-obstruction-summary:sha256:81eb32e40298407580f6b69a3f68067523c27245600dda41438f997051fb8535","ingestion-obstruction-summary:sha256:83025fe4a5ae461495cb82a38a8549e61258e1130456a28f48d7c6d9a66ac21d","ingestion-obstruction-summary:sha256:86d62eb3e6c1858287c9f4eebc02f81ac60b2f3205179ccb7916bf1e70f20fdd","ingestion-obstruction-summary:sha256:8e844571a2de2fd65d0955ab42812a6aadde8aa8ce353ab386edfb28e54c2226","ingestion-obstruction-summary:sha256:8f1374d6a6482636f0dd1fb2e03ad3a42aac2eacf36290b9b5d8c792685cccbb","ingestion-obstruction-summary:sha256:93f79343ace227412eea332b2e2f63b1cb8169b485b48e5dac7654527fdfda13","ingestion-obstruction-summary:sha256:991f3220c33b36282e9adb585bbc9ea1365b2cefc8818c1e318393c0d0c73e41","ingestio